nome,tipo_1,tipo_2,hp,attack,defense,special_attack,special_defense,speed,dex_entry,cluster,cluster_nome,cluster_descricao,dex_entry_tratada
golem,rock,ground,80,120,130,55,65,45,"Its boulder-like body is extremely hard. It can easily withstand dynamite blasts without taking damage. Once a year, this Pokémon molts, and its shed shell returns to the soil. This process creates enriched soil, so farmers collect the shells. It is capable of blowing itself up. It uses this explosive force to jump from mountain to mountain. It is said to live in volcanic craters on mountain peaks. Once a year, it sheds its hide and grows larger. The shed hide crumbles and returns to the soil. Its boulder-like body is extremely hard. It can easily withstand dynamite blasts without damage. Even dynamite can’t harm its hard, boulder-like body. It sheds its hide just once a year. GOLEM live up on mountains. If there is a large earthquake, these POKéMON will come rolling down off the mountains en masse to the foothills below. It is enclosed in a hard shell that is as rugged as slabs of rock. It sheds skin once a year to grow larger. GOLEM is known for rolling down from mountains. To prevent them from rolling into the homes of people downhill, grooves have been dug into the sides of mountains to serve as guideways for diverting this POKéMON’s course. Its rock-like body is so durable, even high-powered dynamite blasts fail to scratch its rugged hide. It sheds its skin once a year. The discarded shell immediately hardens and crumbles away. It detonates its own body. The power from that explosion can propel it up steep mountain paths with amazing speed. Once it sheds its skin, its body turns tender and whitish. Its hide hardens when it's exposed to air. It sheds its hide once a year. Its boulderlike body is so tough, even dynamite can’t harm it. Golem is known for rolling down from mountains. To prevent them from rolling into the homes of people downhill, grooves have been dug into the sides of mountains to serve as guideways for diverting this Pokémon’s course. Golem live up on mountains. If there is a large earthquake, these Pokémon will come rolling down off the mountains en masse to the foothills below. The rocklike shell is shed each year. The cast-off shell then crumbles, reverting to a mass of soil, which can be spread across fields to promote crop growth. Even dynamite can’t harm its hard, boulderlike body. It sheds its hide just once a year. Once it sheds its skin, its body turns tender and whitish. Its hide hardens when it’s exposed to air. When Golem grow old, they stop shedding their shells. Those that have lived a long, long time have shells green with moss. It tumbles down mountains, leaving grooves from peak to base. Stay clear of these grooves. Its body can survive dynamite blasts without a single scratch, but it hates rain and humidity. It sheds its skin once a year. The discarded shell immediately hard­ ens and crumbles away.",0,Muralha Física,"Especialistas em defesa física. Aguentam golpes potentes, mas costumam ser lentos.",boulder like bodi extrem hard easili withstand dynamit blast without take damag year pokemon molt shed shell return soil process creat enrich soil farmer collect shell capabl blow use explos forc jump mountain mountain said live volcan crater mountain peak year shed hide grow larger shed hide crumbl return soil boulder like bodi extrem hard easili withstand dynamit blast without damag even dynamit harm hard boulder like bodi shed hide year golem live mountain larg earthquak pokemon come roll mountain en mass foothil enclos hard shell rug slab rock shed skin year grow larger golem known roll mountain prevent roll home peopl downhil groov dug side mountain serv guideway divert pokemon cours rock like bodi durabl even high power dynamit blast fail scratch rug hide shed skin year discard shell immedi harden crumbl away deton bodi power explos propel steep mountain path amaz speed shed skin bodi turn tender whitish hide harden expos air shed hide year boulderlik bodi tough even dynamit harm golem known roll mountain prevent roll home peopl downhil groov dug side mountain serv guideway divert pokemon cours golem live mountain larg earthquak pokemon come roll mountain en mass foothil rocklik shell shed year cast shell crumbl revert mass soil spread across field promot crop growth even dynamit harm hard boulderlik bodi shed hide year shed skin bodi turn tender whitish hide harden expos air golem grow old stop shed shell live long long time shell green moss tumbl mountain leav groov peak base stay clear groov bodi surviv dynamit blast without singl scratch hate rain humid shed skin year discard shell immedi hard en crumbl away
ponyta,fire,,50,85,55,65,65,90,"As a newborn, it can barely stand. However, through galloping, its legs are made tougher and faster. It can’t run properly when it’s newly born. As it races around with others of its kind, its legs grow stronger. It is a weak run­ ner immediately after birth. It gradually becomes faster by chasing after its parents. Its hind legs, which have hard­ er-than-diamond hooves, kick back at any presence it senses behind it. Capable of jumping incredibly high. Its hooves and sturdy legs absorb the impact of a hard landing. Training by jumping over grass that grows longer every day has made it a world-class jumper. A PONYTA is very weak at birth. It can barely stand up. Its legs become stronger as it stumbles and falls while trying to keep up with its parent. Its hooves are ten times harder than diamond. It can trample anything completely flat in little time. Its legs grow strong while it chases after its parent. It runs in fields and mountains all day. Its hind legs, which have hooves that are harder than diamond, kick back at any presence it senses behind it. If you’ve been accepted by Ponyta, its burning mane is mysteriously no longer hot to the touch. PONYTA is very weak at birth. It can barely stand up. This POKéMON becomes stronger by stumbling and falling to keep up with its parent. Ponyta is very weak at birth. It can barely stand up. This Pokémon becomes stronger by stumbling and falling to keep up with its parent. These Pokémon live in herds out in the grassland. Newborn foals lack their fiery manes, which will develop about an hour after birth. It is a weak runner immediately after birth. It gradually becomes faster by chasing after its parents. About an hour after birth, its fiery mane and tail grow out, giving it an impressive appearance. Its hooves are 10 times harder than diamonds. It can trample anything completely flat in little time. Its body is light, and its legs are incredibly powerful. It can clear Ayers Rock in one leap.",4,Atacante de Elite,Focados em finalizar batalhas. Combinam alta velocidade com grande poder de ataque e ataque especial.,newborn bare stand howev gallop leg made tougher faster run proper newli born race around other kind leg grow stronger weak run ner immedi birth gradual becom faster chase parent hind leg hard er diamond hoov kick back presenc sens behind capabl jump incred high hoov sturdi leg absorb impact hard land train jump grass grow longer everi day made world class jumper ponyta weak birth bare stand leg becom stronger stumbl fall tri keep parent hoov ten time harder diamond trampl anyth complet flat littl time leg grow strong chase parent run field mountain day hind leg hoov harder diamond kick back presenc sens behind accept ponyta burn mane mysteri longer hot touch ponyta weak birth bare stand pokemon becom stronger stumbl fall keep parent ponyta weak birth bare stand pokemon becom stronger stumbl fall keep parent pokemon live herd grassland newborn foal lack fieri mane develop hour birth weak runner immedi birth gradual becom faster chase parent hour birth fieri mane tail grow give impress appear hoov time harder diamond trampl anyth complet flat littl time bodi light leg incred power clear ayer rock one leap
rapidash,fire,,65,100,70,80,80,105,"It just loves to gallop. The faster it goes, the long­ er the swaying flames of its mane will become. With incredible acceleration, it reaches its top speed of 150 mph after running just 10 steps. It can gallop at a top speed of 150 miles per hour. It can race as fast as a bullet train while ablaze. It usually canters casually in the fields and plains. But once a RAPIDASH turns serious, its fiery manes flare and blaze as it gallops its way up to 150 mph. With incredible acceleration, it reaches its top speed of 150 mph after running just ten steps. Just loves to run. If it sees something faster than itself, it will give chase at top speed. At full gallop, its four hooves barely touch the ground because it moves so incredibly fast. RAPIDASH usually can be seen casually cantering in the fields and plains. However, when this POKéMON turns serious, its fiery manes flare and blaze as it gallops its way up to 150 mph. It has astounding acceleration. From a standstill, it can reach top speed within 10 steps. Rapidash usually can be seen casually cantering in the fields and plains. However, when this Pokémon turns serious, its fiery manes flare and blaze as it gallops its way up to 150 mph. Very competitive, this POKéMON will chase anything that moves fast in the hopes of racing it. Very competitive, this Pokémon will chase anything that moves fast in the hopes of racing it. When at an all-out gallop, its blazing mane sparkles, enhancing its beautiful appearance. This Pokémon can be seen galloping through fields at speeds of up to 150 mph, its fiery mane fluttering in the wind. At full gallop, its four hooves barely touch the ground because it moves so incredi­ bly fast. The fastest runner becomes the leader, and it decides the herd’s pace and direction of travel. It gallops at nearly 150 mph. With its mane blazing ferociously, it races as if it were an arrow. Fiery mane aglow, Rapidash darts like an arrow across the land. This prodigiously swift creature can traverse the vast region of Hisui in a day and a half. Just loves to run. If it sees some­ thing faster than itself, it will give chase at top speed.",4,Atacante de Elite,Focados em finalizar batalhas. Combinam alta velocidade com grande poder de ataque e ataque especial.,love gallop faster goe long er sway flame mane becom incred acceler reach top speed mph run step gallop top speed mile per hour race fast bullet train ablaz usual canter casual field plain rapidash turn serious fieri mane flare blaze gallop way mph incred acceler reach top speed mph run ten step love run see someth faster give chase top speed full gallop four hoov bare touch ground move incred fast rapidash usual seen casual canter field plain howev pokemon turn serious fieri mane flare blaze gallop way mph astound acceler standstil reach top speed within step rapidash usual seen casual canter field plain howev pokemon turn serious fieri mane flare blaze gallop way mph competit pokemon chase anyth move fast hope race competit pokemon chase anyth move fast hope race gallop blaze mane sparkl enhanc beauti appear pokemon seen gallop field speed mph fieri mane flutter wind full gallop four hoov bare touch ground move incredi bli fast fastest runner becom leader decid herd pace direct travel gallop near mph mane blaze feroci race arrow fieri mane aglow rapidash dart like arrow across land prodigi swift creatur travers vast region hisui day half love run see thing faster give chase top speed
slowpoke,water,psychic,90,65,65,40,40,15,"It is always so absent-minded that it won't react, even if its flavorful tail is bitten. Slow-witted and oblivious, this Pokémon won’t feel any pain if its tail gets eaten. It won’t notice when its tail grows back, either. Although their tails, which fall off naturally, can easily be found lying around, they’re a precious ingredient for cooking. Incredibly slow and dopey. It takes five seconds for it to feel pain when under attack. When this Pokémon’s tail is soaked in water, sweetness seeps from it. Slowpoke uses this trait to lure in and fish up other Pokémon. A sweet sap leaks from its tail's tip. Although not nutritious, the tail is pleasant to chew on. SLOWPOKE uses its tail to catch prey by dipping it in water at the side of a river. However, this POKéMON often forgets what it’s doing and often spends entire days just loafing at water’s edge. A sweet sap leaks from its tail’s tip. Although not nutritious, the tail is pleasant to chew on. Its long tail often breaks off. It doesn’t really feel any pain, though, and the tail grows back, so Slowpoke isn’t particularly bothered. It lazes vacantly near water. If something bites its tail, it won't even notice for a whole day. Incredibly slow and sluggish. It is quite content to loll about without worrying about the time. It is always vacantly lost in thought, but no one knows what it is thinking about. It is good at fishing with its tail. Although slow, it is skilled at fishing with its tail. It does not feel pain if its tail is bitten. It lazes vacantly near water. If something bites its tail, it won’t even notice for a whole day. Alolan home cooking involves drying Slowpoke tails and then simmering them into a salty stew. It catches prey by dipping its tail in water at the side of a river. But it often forgets what it is doing and spends entire days just loafing at water’s edge. Incredibly slow and dopey. It takes 5 seconds for it to feel pain when under attack. There are some places where Slowpoke is worshiped because of a long-standing belief that whenever Slowpoke yawns, it rains. Slowpoke uses its tail to catch prey by dipping it in water at the side of a river. However, this Pokémon often forgets what it’s doing and often spends entire days just loafing at water’s edge.",1,Equilibrado,"Pokémon equilibrados. Possuem atributos médios e consistentes, sem fraquezas gritantes. Costumam ser pokemons em fases iniciais de evolução.",alway absent mind react even flavor tail bitten slow wit oblivi pokemon feel pain tail get eaten notic tail grow back either although tail fall natur easili found lie around precious ingredi cook incred slow dopey take five second feel pain attack pokemon tail soak water sweet seep slowpok use trait lure fish pokemon sweet sap leak tail tip although nutriti tail pleasant chew slowpok use tail catch prey dip water side river howev pokemon often forget often spend entir day loaf water edg sweet sap leak tail tip although nutriti tail pleasant chew long tail often break realli feel pain though tail grow back slowpok particular bother laze vacant near water someth bite tail even notic whole day incred slow sluggish quit content loll without worri time alway vacant lost thought one know think good fish tail although slow skill fish tail feel pain tail bitten laze vacant near water someth bite tail even notic whole day alolan home cook involv dri slowpok tail simmer salti stew catch prey dip tail water side river often forget spend entir day loaf water edg incred slow dopey take second feel pain attack place slowpok worship long stand belief whenev slowpok yawn rain slowpok use tail catch prey dip water side river howev pokemon often forget often spend entir day loaf water edg
slowbro,water,psychic,95,75,110,100,80,30,"Whenever Shellder bites down hard on its tail, it gives Slowbro a flash of inspiration...which it forgets a moment later. When a Slowpoke went hunting in the sea, its tail was bitten by a Shellder. That made it evolve into Slowbro. Naturally dull to begin with, it lost its ability to feel pain due to SHELLDER's seeping poison. Shellder, in its greed to suck out more and more sweetness from Slowbro’s tail, has metamorphosed into a spiral-shaped shell. Its tail has a SHELLDER firmly attached with a bite. As a result, the tail can’t be used for fishing anymore. This forces it to reluctantly swim and catch prey. The SHELLDER that latches onto SLOWPOKE’s tail is said to feed on the host’s leftover scraps. An attached SHELLDER won't let go because of the tasty flavor that oozes out of its tail. Lives lazily by the sea. If the Shellder on its tail comes off, it becomes a Slowpoke again. If the tail-biting SHELLDER is thrown off in a harsh battle, it reverts to being an ordi­ nary SLOWPOKE. An attached Shellder won’t let go because of the tasty flavor that oozes out of its tail. When a SLOWPOKE went hunting in the sea, its tail was bitten by a SHELLDER. That made it evolve into SLOWBRO. Lives lazily by the sea. If the SHELLDER on its tail comes off, it becomes a SLOWPOKE again. SLOWBRO’s tail has a SHELLDER firmly attached with a bite. As a result, the tail can’t be used for fishing anymore. This causes SLOWBRO to grudgingly swim and catch prey instead. If the tail-biting SHELLDER is thrown off in a harsh battle, it reverts to being an ordinary SLOWPOKE. Slowpoke became Slowbro when a Shellder bit on to its tail. Sweet flavors seeping from the tail make the Shellder feel as if its life is a dream. Though usually dim witted, it seems to become inspired if the SHELLDER on its tail bites down. Spacing out is basically all it does. It turns back into Slowpoke if its tail, along with Shellder, breaks off. Though usually dim witted, it seems to become inspired if the Shellder on its tail bites down. The SHELLDER that is latched onto SLOWPOKE's tail is said to feed on the host's left over scraps. Naturally dull to begin with, it lost its ability to feel pain due to SHELLDER’s seeping poison. It spaces out while gazing at the sea. With Shellder’s poison flowing through its body, it becomes even spacier. Slowbro’s tail has a Shellder firmly attached with a bite. As a result, the tail can’t be used for fishing anymore. This causes Slowbro to grudgingly swim and catch prey instead. Being bitten by a Shellder shocked this Pokémon into standing on two legs. If the Shellder lets go, it seems Slowbro will turn back into a Slowpoke.",2,Colosso de Vitalidade,Os pesos-pesados. Destacam-se pelo HP altíssimo e grande resistência a danos especiais. Possuem os restantes dos atributos médios/altos.,whenev shellder bite hard tail give slowbro flash inspir forget moment later slowpok went hunt sea tail bitten shellder made evolv slowbro natur dull begin lost abil feel pain due shellder seep poison shellder greed suck sweet slowbro tail metamorphos spiral shape shell tail shellder firm attach bite result tail use fish anymor forc reluct swim catch prey shellder latch onto slowpok tail said feed host leftov scrap attach shellder let go tasti flavor ooz tail live lazili sea shellder tail come becom slowpok tail bite shellder thrown harsh battl revert ordi nari slowpok attach shellder let go tasti flavor ooz tail slowpok went hunt sea tail bitten shellder made evolv slowbro live lazili sea shellder tail come becom slowpok slowbro tail shellder firm attach bite result tail use fish anymor caus slowbro grudg swim catch prey instead tail bite shellder thrown harsh battl revert ordinari slowpok slowpok becam slowbro shellder bit tail sweet flavor seep tail make shellder feel life dream though usual dim wit seem becom inspir shellder tail bite space basic turn back slowpok tail along shellder break though usual dim wit seem becom inspir shellder tail bite shellder latch onto slowpok tail said feed host left scrap natur dull begin lost abil feel pain due shellder seep poison space gaze sea shellder poison flow bodi becom even spacier slowbro tail shellder firm attach bite result tail use fish anymor caus slowbro grudg swim catch prey instead bitten shellder shock pokemon stand two leg shellder let go seem slowbro turn back slowpok
magnemite,electric,steel,25,35,70,95,55,45,"Magnemite floats in the air by emitting electromagnetic waves from the units at its sides. These waves block gravity. This Pokémon becomes incapable of flight if its internal electrical supply is depleted. It sends out electromagnetic waves, which let it float through the air. Touching it while it’s eating electricity will give you a full-body shock. It subsists on electricity. As Magnemite flies, it emits electromagnetic waves from the units on each side of its body. The faster the units at its sides rotate, the greater the magnetic force they generate. The units at the sides of its body generate antigravity energy to keep it aloft in the air. It is attracted by electromagnetic waves. It may approach Trainers if they are using their Pokégear. It is attracted by electromagnetic waves. It may approach trainers if they are using their POKéGEAR. The electricity emitted by the units on each side of its body cause it to become a strong magnet. It moves while constantly hovering. It discharges THUNDER WAVE and so on from the units at its sides. It is hatched with the ability to defy gravity. It floats while emitting powerful electromagnetic waves. Magnemite attaches itself to power lines to feed on electricity. If your house has a power outage, check your circuit breakers. You may find a large number of this Pokémon clinging to the breaker box. The electromagnetic waves emitted by the units at the sides of its head expel antigravity, which allows it to float. It is born with the ability to defy gravity. It floats in air on powerful electro­ magnetic waves. At times, Magnemite runs out of electricity and ends up on the ground. If you give batteries to a grounded Magnemite, it’ll start moving again. They gather in places where electricity is available. They can be found clinging to the steel towers used to support power lines. MAGNEMITE attaches itself to power lines to feed on electricity. If your house has a power outage, check your circuit breakers. You may find a large number of this POKéMON clinging to the breaker box. The units at its sides are extremely powerful magnets. They generate enough magnetism to draw in iron objects from over 300 feet away. Perhaps because electrical lines are often buried these days, the number of Magnemite attacks on power plants has increased. The units at its sides generate electromagnetic waves that keep it airborne. It feeds on electricity. A bizarre Pokémon with but a single eye embedded in an iron sphere. I suspect this creature levitates due to the magnetism it emits from its arms, which resemble horseshoe-shaped magnets. MAGNEMITE floats in the air by emitting electromagnetic waves from the units at its sides. These waves block gravity. This POKéMON becomes incapable of flight if its internal electrical supply is depleted. It’s frequently the cause of power outages, which is why some power plants send out electrical signals that it can’t stand. It moves while constantly hovering. It discharges Thunder Wave and so on from the units at its sides. Uses anti-gravity to stay suspended. Appears without warning and uses THUNDER WAVE and similar moves. The units at the sides of its body generate anti­ gravity energy to keep it aloft in the air. Uses antigravity to stay suspended. Appears without warning and uses THUNDER WAVE and similar moves.",1,Equilibrado,"Pokémon equilibrados. Possuem atributos médios e consistentes, sem fraquezas gritantes. Costumam ser pokemons em fases iniciais de evolução.",magnemit float air emit electromagnet wave unit side wave block graviti pokemon becom incap flight intern electr suppli deplet send electromagnet wave let float air touch eat electr give full bodi shock subsist electr magnemit fli emit electromagnet wave unit side bodi faster unit side rotat greater magnet forc generat unit side bodi generat antigrav energi keep aloft air attract electromagnet wave may approach trainer use pokegear attract electromagnet wave may approach trainer use pokegear electr emit unit side bodi caus becom strong magnet move constant hover discharg thunder wave unit side hatch abil defi graviti float emit power electromagnet wave magnemit attach power line feed electr hous power outag check circuit breaker may find larg number pokemon cling breaker box electromagnet wave emit unit side head expel antigrav allow float born abil defi graviti float air power electro magnet wave time magnemit run electr end ground give batteri ground magnemit start move gather place electr avail found cling steel tower use support power line magnemit attach power line feed electr hous power outag check circuit breaker may find larg number pokemon cling breaker box unit side extrem power magnet generat enough magnet draw iron object feet away perhap electr line often buri day number magnemit attack power plant increas unit side generat electromagnet wave keep airborn feed electr bizarr pokemon singl eye embed iron sphere suspect creatur levit due magnet emit arm resembl horsesho shape magnet magnemit float air emit electromagnet wave unit side wave block graviti pokemon becom incap flight intern electr suppli deplet frequent caus power outag power plant send electr signal stand move constant hover discharg thunder wave unit side use anti graviti stay suspend appear without warn use thunder wave similar move unit side bodi generat anti graviti energi keep aloft air use antigrav stay suspend appear without warn use thunder wave similar move
