nome,tipo_1,tipo_2,hp,attack,defense,special_attack,special_defense,speed,dex_entry,cluster,cluster_nome,cluster_descricao,dex_entry_tratada
vileplume,grass,poison,75,80,85,110,90,50,"Its petals are the largest in the world. It fiendishly scatters allergy-causing pollen from its petals. The bud bursts into bloom with a bang. It then starts scattering allergenic, poisonous pollen. It has the world's largest petals. With every step, the petals shake out heavy clouds of toxic pollen. It has the world’s largest petals. With every step, the petals shake out heavy clouds of toxic pollen. By shaking its big petals, it scat­ ters toxic pollen into the air, turning the air yellow. The bud bursts into bloom with a bang. It then starts scattering allergenic, poi­ sonous pollen. Vileplume has the world’s largest petals. They are used to attract prey that are then doused with toxic spores. Once the prey are immobilized, this Pokémon catches and devours them. Vileplume’s toxic pollen triggers atrocious allergy attacks. That’s why it is advisable never to approach any attractive flowers in a jungle, however pretty they may be. VILEPLUME has the world’s largest petals. They are used to attract prey that are then doused with toxic spores. Once the prey are immobilized, this POKéMON catches and devours them. Flaps its broad flower petals to scatter its poisonous pollen. The flapping sound is very loud. VILEPLUME’s toxic pollen triggers atrocious allergy attacks. That’s why it is advisable never to approach any attractive flowers in a jungle, however pretty they may be. In seasons when it produces more pollen, the air around a VILEPLUME turns yellow with the powder as it walks. The pollen is highly toxic and causes paralysis. The larger its petals, the more toxic pollen it contains. Its big head is heavy and hard to hold up. Its petals are the largest in the world. As it walks, it scatters extremely allergenic pollen.",2,Colosso de Vitalidade,Os pesos-pesados. Destacam-se pelo HP altíssimo e grande resistência a danos especiais. Possuem os restantes dos atributos médios/altos.,petal largest world fiendish scatter allergi caus pollen petal bud burst bloom bang start scatter allergen poison pollen world largest petal everi step petal shake heavi cloud toxic pollen world largest petal everi step petal shake heavi cloud toxic pollen shake big petal scat ter toxic pollen air turn air yellow bud burst bloom bang start scatter allergen poi sonous pollen vileplum world largest petal use attract prey dous toxic spore prey immobil pokemon catch devour vileplum toxic pollen trigger atroci allergi attack advis never approach attract flower jungl howev pretti may vileplum world largest petal use attract prey dous toxic spore prey immobil pokemon catch devour flap broad flower petal scatter poison pollen flap sound loud vileplum toxic pollen trigger atroci allergi attack advis never approach attract flower jungl howev pretti may season produc pollen air around vileplum turn yellow powder walk pollen high toxic caus paralysi larger petal toxic pollen contain big head heavi hard hold petal largest world walk scatter extrem allergen pollen
paras,bug,grass,35,70,55,45,55,25,"Mushrooms called tochukaso sprout from its back. They can be dried and powdered to make a medicine used to extend life. PARAS has parasitic mushrooms growing on its back called tochukaso. They grow large by drawing nutrients from this BUG POKéMON host. They are highly valued as a medicine for extending life. PARAS has parasitic mushrooms growing on its back called tochukaso. They grow large by drawing nutrients from the BUG POKéMON host. They are highly valued as a medicine for extending life. As its body grows, large mushrooms named tochukaso start sprouting out of its back. Burrows under the ground to gnaw on tree roots. The mushrooms on its back absorb most of the nutrition. A PARAS has parasitic tochukaso mushrooms growing on its back. They grow by drawing nutrients from the host. They are valued as a medicine for long life. Paras has parasitic mushrooms growing on its back called tochukaso. They grow large by drawing nutrients from this Bug Pokémon host. They are highly valued as a medicine for extending life. Whether it’s due to a lack of moisture or a lack of nutrients, in Alola the mushrooms on Paras don’t grow up quite right. The tochukaso growing on this POKéMON's back orders it to extract juice from tree trunks. Mushrooms named tochukaso grow on its back. They grow along with the host Paras. The mushrooms, known as tochukaso, are controlling the bug. Even if the bug bugs the mushrooms, they tell it to bug off. As its body grows large, oriental mushrooms named tochukaso start sprouting out of its back. Burrows to suck tree roots. The mushrooms on its back grow by draw­ ing nutrients from the bug host. No matter how much it eats, the mushrooms growing on its back steal away most of the nutrients it consumes. Burrows to suck tree roots. The mushrooms on its back grow by drawing nutrients from the bug host. It is doused with mushroom spores when it is born. As its body grows, mushrooms sprout from its back. Growing out of the bug’s back are mushrooms called tochukaso. The mushrooms grow with the bug host. Mushrooms named tochukaso grow on its back. They grow along with the host PARAS. Sometimes seen at the foot of trees in humid forests. The mushrooms on its back—called tochukaso—are not present on infant specimens and instead emerge as Paras matures.",1,Equilibrado,"Pokémon equilibrados. Possuem atributos médios e consistentes, sem fraquezas gritantes. Costumam ser pokemons em fases iniciais de evolução.",mushroom call tochukaso sprout back dri powder make medicin use extend life para parasit mushroom grow back call tochukaso grow larg draw nutrient bug pokemon host high valu medicin extend life para parasit mushroom grow back call tochukaso grow larg draw nutrient bug pokemon host high valu medicin extend life bodi grow larg mushroom name tochukaso start sprout back burrow ground gnaw tree root mushroom back absorb nutrit para parasit tochukaso mushroom grow back grow draw nutrient host valu medicin long life para parasit mushroom grow back call tochukaso grow larg draw nutrient bug pokemon host high valu medicin extend life whether due lack moistur lack nutrient alola mushroom para grow quit right tochukaso grow pokemon back order extract juic tree trunk mushroom name tochukaso grow back grow along host para mushroom known tochukaso control bug even bug bug mushroom tell bug bodi grow larg orient mushroom name tochukaso start sprout back burrow suck tree root mushroom back grow draw ing nutrient bug host matter much eat mushroom grow back steal away nutrient consum burrow suck tree root mushroom back grow draw nutrient bug host dous mushroom spore born bodi grow mushroom sprout back grow bug back mushroom call tochukaso mushroom grow bug host mushroom name tochukaso grow back grow along host para sometim seen foot tree humid forest mushroom back call tochukaso present infant specimen instead emerg para matur
parasect,bug,grass,60,95,80,60,80,30,"A host-parasite pair in which the parasite mushroom has taken over the host bug. Prefers damp places. It scatters toxic spores from its mushroom cap. Once harvested, these spores can be steeped and boiled down to prepare herbal medicines. The larger the mushroom on its back grows, the stronger the mush­ room spores it scatters. The bug is mostly dead, with the mushroom on its back having become the main body. If the mushroom comes off, the bug stops moving. A mushroom grown larger than the host’s body controls PARASECT. It scatters poisonous spores. A host-parasite pair in which the parasite mushroom has taken over the host bug. Prefers damp places.  It scatters toxic spores from the mushroom cap. In China, the spores are used as herbal medicine. A mushroom grown larger than the host’s body controls Parasect. It scatters poisonous spores. It stays mostly in dark, damp places, the preference not of the bug, but of the big mush­ rooms on its back. PARASECT is known to infest large trees en masse and drain nutrients from the lower trunk and roots. When an infested tree dies, they move onto another tree all at once. Its poisonous spores are also used in traditional medicine. Apparently, spores produced in Alola are not of very good quality. The large mushroom on its back controls it. It often fights over territory with Shiinotic. The bug host is drained of energy by the mushrooms on its back. They appear to do all the thinking. The bug host is drained of energy by the mushroom on its back. The mushroom appears to do all the thinking. Mushroom-lacking specimens of this Pokémon lie unmoving in the forest, lending credence to the hypothesis that the large mushroom is in control of Parasect's actions. It stays mostly in dark, damp places, the preference not of the bug, but of the big mushroom on its back. It is controlled by a mushroom grown larger than the bug body. It is said to prefer damp places. PARASECT are known to infest the roots of large trees en masse and drain nutrients. When an infested tree dies, they move onto another tree all at once. Parasect is known to infest large trees en masse and drain nutrients from the lower trunk and roots. When an infested tree dies, they move onto another tree all at once. The larger the mushroom on its back grows, the stronger the mushroom spores it scatters. When nothing's left to extract from the bug, the mushrooms on its back leave spores on the bug's egg.",1,Equilibrado,"Pokémon equilibrados. Possuem atributos médios e consistentes, sem fraquezas gritantes. Costumam ser pokemons em fases iniciais de evolução.",host parasit pair parasit mushroom taken host bug prefer damp place scatter toxic spore mushroom cap harvest spore steep boil prepar herbal medicin larger mushroom back grow stronger mush room spore scatter bug most dead mushroom back becom main bodi mushroom come bug stop move mushroom grown larger host bodi control parasect scatter poison spore host parasit pair parasit mushroom taken host bug prefer damp place scatter toxic spore mushroom cap china spore use herbal medicin mushroom grown larger host bodi control parasect scatter poison spore stay most dark damp place prefer bug big mush room back parasect known infest larg tree en mass drain nutrient lower trunk root infest tree die move onto anoth tree poison spore also use tradit medicin appar spore produc alola good qualiti larg mushroom back control often fight territori shiinot bug host drain energi mushroom back appear think bug host drain energi mushroom back mushroom appear think mushroom lack specimen pokemon lie unmov forest lend credenc hypothesi larg mushroom control parasect action stay most dark damp place prefer bug big mushroom back control mushroom grown larger bug bodi said prefer damp place parasect known infest root larg tree en mass drain nutrient infest tree die move onto anoth tree parasect known infest larg tree en mass drain nutrient lower trunk root infest tree die move onto anoth tree larger mushroom back grow stronger mushroom spore scatter noth left extract bug mushroom back leav spore bug egg
venonat,bug,poison,60,55,50,40,55,45,"Its big eyes are actually clusters of tiny eyes. At night, its kind is drawn by light. Lives in the shadows of tall trees where it eats insects. It is attracted by light at night. Lives in the shadows of tall trees where it eats bugs. It is attracted by light at night. Its large eyes act as radars. In a bright place, you can see that they are clusters of many tiny eyes. VENONAT is said to have evolved with a coat of thin, stiff hair that covers its entire body for protection. It possesses large eyes that never fail to spot even miniscule prey. Its large eyes act as radar. In a bright place, you can see that they are clusters of many tiny eyes. Poison oozes from all over its body. It catches and eats small bugs at night that are attracted by light. Poison oozes from all over its body. It catches and eats small bugs at night that are at­ tracted by light. Its coat of thin, stiff hair that covers its entire body is said to have evolved for protection. Its large eyes never fail to spot even miniscule prey. The small bugs it eats appear only at night, so it sleeps in a hole in a tree until night falls. Venonat is said to have evolved with a coat of thin, stiff hair that covers its entire body for protection. It possesses large eyes that never fail to spot even minuscule prey. Its eyes act as radar, enabling it to be active in darkness. The eyes can also shoot powerful beams. Its eyes also function as radar units. It catches and eats small bugs that hide in darkness.",1,Equilibrado,"Pokémon equilibrados. Possuem atributos médios e consistentes, sem fraquezas gritantes. Costumam ser pokemons em fases iniciais de evolução.",big eye actual cluster tini eye night kind drawn light live shadow tall tree eat insect attract light night live shadow tall tree eat bug attract light night larg eye act radar bright place see cluster mani tini eye venonat said evolv coat thin stiff hair cover entir bodi protect possess larg eye never fail spot even miniscul prey larg eye act radar bright place see cluster mani tini eye poison ooz bodi catch eat small bug night attract light poison ooz bodi catch eat small bug night tract light coat thin stiff hair cover entir bodi said evolv protect larg eye never fail spot even miniscul prey small bug eat appear night sleep hole tree night fall venonat said evolv coat thin stiff hair cover entir bodi protect possess larg eye never fail spot even minuscul prey eye act radar enabl activ dark eye also shoot power beam eye also function radar unit catch eat small bug hide dark
venomoth,bug,poison,70,65,60,90,75,90,"It flutters its wings to scatter dustlike scales. The scales leach toxins if they contact skin. When it attacks, it flaps its large wings violently to scatter its poisonous powder all around. The powder on its wings is poisonous if it is dark in hue. If it is light in hue, it causes paralysis. The dust-like scales covering its wings are color coded to indicate the kinds of poison it has. The scales it scatters will paralyze anyone who touches them, making that person unable to stand. The dustlike scales covering its wings are color-coded to indicate the kinds of poison it has. VENOMOTH are nocturnal--they only are active at night. Their favorite prey are insects that gather around streetlights, attracted by the light in the darkness. The powdery scales on its wings are hard to remove. They also contain poison that leaks out on contact. The powdery scales on its wings are hard to remove from skin. They also contain poison that leaks out on contact. The wings are covered with dustlike scales. Every time it flaps its wings, it looses highly toxic dust. VENOMOTH is nocturnal - it is a POKéMON that only becomes active at night. Its favorite prey are small insects that gather around streetlights, attracted by the light in the darkness. The powder on its wings is poisonous if it is dark in color. If it is light, it causes paralysis. When it attacks, it flaps its large wings violently to scatter its poi­ sonous powder all around. Venomoth is nocturnal—it is a Pokémon that only becomes active at night. Its favorite prey are small insects that gather around streetlights, attracted by the light in the darkness.",4,Atacante de Elite,Focados em finalizar batalhas. Combinam alta velocidade com grande poder de ataque e ataque especial.,flutter wing scatter dustlik scale scale leach toxin contact skin attack flap larg wing violent scatter poison powder around powder wing poison dark hue light hue caus paralysi dust like scale cover wing color code indic kind poison scale scatter paralyz anyon touch make person unabl stand dustlik scale cover wing color code indic kind poison venomoth nocturn activ night favorit prey insect gather around streetlight attract light dark powderi scale wing hard remov also contain poison leak contact powderi scale wing hard remov skin also contain poison leak contact wing cover dustlik scale everi time flap wing loos high toxic dust venomoth nocturn pokemon becom activ night favorit prey small insect gather around streetlight attract light dark powder wing poison dark color light caus paralysi attack flap larg wing violent scatter poi sonous powder around venomoth nocturn pokemon becom activ night favorit prey small insect gather around streetlight attract light dark
diglett,ground,,10,55,25,35,45,95,"Lives about one yard underground where it feeds on plant roots. It sometimes appears above ground. Diglett are raised in most farms. The reason is simple— wherever this Pokémon burrows, the soil is left perfectly tilled for planting crops. This soil is made ideal for growing delicious vegetables. It travels through tunnels that it digs underground. It hates sunlight, so it comes out only after the sun goes down. A Pokémon that lives underground. Because of its dark habitat, it is repelled by bright sunlight. Its skin is very thin. If it is exposed to light, its blood heats up, causing it to grow weak. It chews on plant roots underground. Farmers whose vegetables are vulnerable find it can be quite a pest. It digs under­ ground and chews on tree roots, sticking its head out only when the sun isn't bright. If a DIGLETT DIGS through a field, it leaves the soil perfectly tilled and ideal for planting crops. DIGLETT are raised in most farms. The reason is simple - wherever this POKéMON burrows, the soil is left perfectly tilled for planting crops. This soil is made ideal for growing delicious vegetables. It burrows through the ground at a shallow depth. It leaves raised earth in its wake, making it easy to spot. If a DIGLETT digs through a field, it leaves the soil perfectly tilled and ideal for planting crops. Many farmers cherish and nurture Diglett because its droppings enrich the soil it lives in. Around their crops, farmers plant the kind of tree that Diglett like to eat as a way of getting Diglett to plow the fields for them. Lives about one yard underground where it feeds on plant roots. It sometimes appears aboveground. If a Diglett digs through a field, it leaves the soil perfectly tilled and ideal for planting crops. It prefers dark places. It spends most of its time underground, though it may pop up in caves. DIGLETT are raised in most farms. The reason is simple--wherever they burrow, the soil is left perfectly tilled for growing delicious crops.",3,Básico,"Estágios primários de evolução. Possuem potencial de crescimento, mas atributos base baixos.",live one yard underground feed plant root sometim appear ground diglett rais farm reason simpl wherev pokemon burrow soil left perfect till plant crop soil made ideal grow delici veget travel tunnel dig underground hate sunlight come sun goe pokemon live underground dark habitat repel bright sunlight skin thin expos light blood heat caus grow weak chew plant root underground farmer whose veget vulner find quit pest dig ground chew tree root stick head sun bright diglett dig field leav soil perfect till ideal plant crop diglett rais farm reason simpl wherev pokemon burrow soil left perfect till plant crop soil made ideal grow delici veget burrow ground shallow depth leav rais earth wake make easi spot diglett dig field leav soil perfect till ideal plant crop mani farmer cherish nurtur diglett drop enrich soil live around crop farmer plant kind tree diglett like eat way get diglett plow field live one yard underground feed plant root sometim appear aboveground diglett dig field leav soil perfect till ideal plant crop prefer dark place spend time underground though may pop cave diglett rais farm reason simpl wherev burrow soil left perfect till grow delici crop
dugtrio,ground,,35,100,50,50,70,120,"Extremely power­ ful, they can DIG through even the hardest ground to a depth of over 60 miles. These Diglett triplets dig over 60 miles below sea level. No one knows what it’s like underground. Dugtrio’s heads are sleek and smooth and incredibly hard. It can dig through any soil with its headbutts. Extremely powerful, they can dig through even the hardest ground to a depth of over 60 miles. Despite the closeness between this Pokémon and farmers and other people, no one has ever seen the parts of it concealed underground. DUGTRIO are actually triplets that emerged from one body. As a result, each triplet thinks exactly like the other two triplets. They work cooperatively to burrow endlessly. Dugtrio are actually triplets that emerged from one body. As a result, each triplet thinks exactly like the other two triplets. They work cooperatively to burrow endlessly. While the three of them normally get along splendidly, on rare occasions a huge fight will break out over which head gets to eat first. These DIGLETT triplets dig over 60 miles below sea level. No one knows what it's like underground. A team of DIGLETT triplets. It triggers huge earthquakes by burrowing 60 miles underground. This set of triplets moves cooperatively. It’s the power of teamwork that enables this Pokémon to dig to a depth of 60 miles. A team of triplets that can burrow to a depth of 60 miles. It’s reported that this triggers an earthquake. A team of Diglett triplets. It triggers huge earthquakes by burrowing 60 miles underground. In battle, it digs through the ground and strikes the unsuspecting foe from an unexpected direction. Its three heads bob separately up and down to loosen the soil nearby, making it easier for it to burrow. A team of triplets that can burrow over 60 MPH. Due to this, some people think it's an earthquake. Because the triplets originally split from one body, they think exactly alike. They work cooperatively to burrow endlessly through the ground. Its three heads move alternately, driving it through tough soil to depths of over 60 miles.",4,Atacante de Elite,Focados em finalizar batalhas. Combinam alta velocidade com grande poder de ataque e ataque especial.,extrem power ful dig even hardest ground depth mile diglett triplet dig mile sea level one know like underground dugtrio head sleek smooth incred hard dig soil headbutt extrem power dig even hardest ground depth mile despit close pokemon farmer peopl one ever seen part conceal underground dugtrio actual triplet emerg one bodi result triplet think exact like two triplet work cooper burrow endless dugtrio actual triplet emerg one bodi result triplet think exact like two triplet work cooper burrow endless three normal get along splendid rare occas huge fight break head get eat first diglett triplet dig mile sea level one know like underground team diglett triplet trigger huge earthquak burrow mile underground set triplet move cooper power teamwork enabl pokemon dig depth mile team triplet burrow depth mile report trigger earthquak team diglett triplet trigger huge earthquak burrow mile underground battl dig ground strike unsuspect foe unexpect direct three head bob separ loosen soil nearbi make easier burrow team triplet burrow mph due peopl think earthquak triplet origin split one bodi think exact alik work cooper burrow endless ground three head move altern drive tough soil depth mile
