nome,tipo_1,tipo_2,hp,attack,defense,special_attack,special_defense,speed,dex_entry,cluster,cluster_nome,cluster_descricao,dex_entry_tratada
koffing,poison,,40,65,95,60,45,35,"The poisonous gases it contains are a little bit lighter than air, keeping it slight­ ly airborne. Its thin, balloon-like body is inflated by horribly toxic gases. It reeks when it is nearby. The poisonous gases it contains are a little bit lighter than air, keeping it slightly airborne. Lighter-than-air gases in its body keep it aloft. The gases not only smell, they are also explosive. KOFFING embodies toxic substances. It mixes the toxins with raw garbage to set off a chemical reaction that results in a terribly powerful poison gas. The higher the temperature, the more gas is concocted by this POKéMON. Its thin, filmy body is filled with gases that cause constant sniffles, coughs and teary eyes. Its body is full of poisonous gas. It floats into garbage dumps, seeking out the fumes of raw, rotting trash. If KOFFING becomes agitated, it raises the toxicity of its internal gases and jets them out from all over its body. This POKéMON may also overinflate its round body, then explode. If one gets close enough to it when it expels poison­ ous gas, the gas swirling inside it can be seen. Getting up close to a KOFFING will give you a chance to observe, through its thin skin, the toxic gases swirling inside. It blows up at the slightest stimulation. Because it stores several kinds of toxic gases in its body, it is prone to exploding without warning. If Koffing becomes agitated, it raises the toxicity of its internal gases and jets them out from all over its body. This Pokémon may also overinflate its round body, then explode. Koffing embodies toxic substances. It mixes the toxins with raw garbage to set off a chemical reaction that results in a terribly powerful poison gas. The higher the temperature, the more gas is concocted by this Pokémon. Toxic gas is held within its thin, balloon-shaped body, so it can cause massive explosions. It adores polluted air. Some claim that Koffing used to be more plentiful in the Galar region than they are now. In hot places, its internal gases could expand and explode without any warning. Be very careful!",0,Muralha Física,"Especialistas em defesa física. Aguentam golpes potentes, mas costumam ser lentos.",poison gase contain littl bit lighter air keep slight ly airborn thin balloon like bodi inflat horribl toxic gase reek nearbi poison gase contain littl bit lighter air keep slight airborn lighter air gase bodi keep aloft gase smell also explos kof embodi toxic substanc mix toxin raw garbag set chemic reaction result terribl power poison gas higher temperatur gas concoct pokemon thin filmi bodi fill gase caus constant sniffl cough teari eye bodi full poison gas float garbag dump seek fume raw rot trash kof becom agit rais toxic intern gase jet bodi pokemon may also overinfl round bodi explod one get close enough expel poison ous gas gas swirl insid seen get close kof give chanc observ thin skin toxic gase swirl insid blow slightest stimul store sever kind toxic gase bodi prone explod without warn kof becom agit rais toxic intern gase jet bodi pokemon may also overinfl round bodi explod kof embodi toxic substanc mix toxin raw garbag set chemic reaction result terribl power poison gas higher temperatur gas concoct pokemon toxic gas held within thin balloon shape bodi caus massiv explos ador pollut air claim kof use plenti galar region hot place intern gase could expand explod without warn care
weezing,poison,,65,90,120,85,70,60,"Where two kinds of poison gases meet, two KOFFING can fuse into a WEEZING over many years. If one of the twin KOFFING inflates, the other one deflates. It con­ stantly mixes its poisonous gases. Where two kinds of poison gases meet, 2 KOFFINGs can fuse into a WEEZING over many years. Weezing loves the gases given off by rotted kitchen garbage. This Pokémon will find a dirty, unkempt house and make it its home. At night, when the people in the house are asleep, it will go through the trash. If one of the twin Koffing inflates, the other one deflates. It constantly mixes its poisonous gases. Inhaling toxic fumes from trash and mixing them inside its body lets it spread an even fouler stench. WEEZING alternately shrinks and inflates its twin bodies to mix together toxic gases inside. The more the gases are mixed, the more powerful the toxins become. The POKéMON also becomes more putrid. It grows by feeding on gases released by garbage. Though very rare, triplets have been found. Weezing alternately shrinks and inflates its twin bodies to mix together toxic gases inside. The more the gases are mixed, the more powerful the toxins become. The Pokémon also becomes more putrid. It can’t suck in air quite as well as a Galarian Weezing, but the toxins it creates are more potent than those of its counterpart. Very rarely, a sudden mutation can result in two small KOFFING twins becoming conjoined as a WEEZING. WEEZING loves the gases given off by rotted kitchen garbage. This POKéMON will find a dirty, unkempt house and make it its home. At night, when the people in the house are asleep, it will go through the trash. Top-grade perfume is made using its internal poison gases by diluting them to the high­ est level. This Pokémon lives and grows by absorbing poison gas, dust, and germs that exist inside garbage. If one of the twin KOFFING inflates, the other one deflates. It constantly mixes its poisonous gases. Top-grade perfume is made using its internal poison gases by diluting them to the highest level. When it inhales poisonous gases from garbage, its body expands, and its insides smell much worse. It mixes gases between its two bodies. It’s said that these Pokémon were seen all over the Galar region back in the day. Very rarely, a sudden mutation can result in two small Koffing twins becoming conjoined as a Weezing. By diluting its toxic gases with a special process, the highest grade of perfume can be extracted. To WEEZING, gases emanating from garbage are the ultimate feast. It lives and grows by absorbing dust, germs and poison gases that are contained in toxic waste and garbage.",0,Muralha Física,"Especialistas em defesa física. Aguentam golpes potentes, mas costumam ser lentos.",two kind poison gase meet two kof fuse weez mani year one twin kof inflat one deflat con stant mix poison gase two kind poison gase meet kof fuse weez mani year weez love gase given rot kitchen garbag pokemon find dirti unkempt hous make home night peopl hous asleep go trash one twin kof inflat one deflat constant mix poison gase inhal toxic fume trash mix insid bodi let spread even fouler stench weez altern shrink inflat twin bodi mix togeth toxic gase insid gase mix power toxin becom pokemon also becom putrid grow feed gase releas garbag though rare triplet found weez altern shrink inflat twin bodi mix togeth toxic gase insid gase mix power toxin becom pokemon also becom putrid suck air quit well galarian weez toxin creat potent counterpart rare sudden mutat result two small kof twin becom conjoin weez weez love gase given rot kitchen garbag pokemon find dirti unkempt hous make home night peopl hous asleep go trash top grade perfum made use intern poison gase dilut high est level pokemon live grow absorb poison gas dust germ exist insid garbag one twin kof inflat one deflat constant mix poison gase top grade perfum made use intern poison gase dilut highest level inhal poison gase garbag bodi expand insid smell much wors mix gase two bodi said pokemon seen galar region back day rare sudden mutat result two small kof twin becom conjoin weez dilut toxic gase special process highest grade perfum extract weez gase eman garbag ultim feast live grow absorb dust germ poison gase contain toxic wast garbag
rhyhorn,ground,rock,80,85,95,30,30,25,"RHYHORN’s brain is very small. It is so dense, while on a run it forgets why it started running in the first place. It apparently remembers sometimes if it demolishes something. Its massive bones are 1000 times harder than human bones. It can easily knock a trailer flying. Its powerful tackles can destroy anything. However, it is too slow witted to help people work. Strong, but not too bright, this Pokémon can shatter even a skyscraper with its charging tackles. It doesn't care if there is anything in its way. It just charges and destroys all ob­ stacles. Strong, but not too bright, this POKéMON can shatter even a skyscraper with its charging TACKLES. Strong, but not too bright, this Pokémon can shatter even a skyscraper with its charging Tackles. Once it starts running, it doesn’t stop. Its tiny brain makes it so stupid that it can’t remember why it started running in the first place. Rhyhorn runs in a straight line, smashing everything in its path. It is not bothered even if it rushes headlong into a block of steel. This Pokémon may feel some pain from the collision the next day, however. A POKéMON with a one-track mind. Once it charges,  it won't stop running until it falls asleep. A Pokémon with a one-track mind. Once it charges, it won’t stop running until it falls asleep. It can remember only one thing at a time. Once it starts rushing, it forgets why it started. It doesn’t care if there is anything in its way. It just charges and destroys all obstacles. Ludicrously strong—when it butts heads with a mountain, it is the mountain that shatters. But its short legs struggle with turns, and it is incapable of stopping unless it collides with something. Its body is clad in a thick hide, and its tackles topple buildings. Unfortunately, it is not smart. Its massive bones are 1,000 times harder than human bones. Its TACKLE can knock a semitrailer flying. It is inept at turning because of its four short legs. It can only charge and run in one direction. Rhyhorn’s brain is very small. It is so dense, while on a run it forgets why it started running in the first place. It apparently remembers sometimes if it demolishes something. RHYHORN runs in a straight line, smashing everything in its path. It is not bothered even if it rushes headlong into a block of steel. This POKéMON may feel some pain from the collision the next day, however.",0,Muralha Física,"Especialistas em defesa física. Aguentam golpes potentes, mas costumam ser lentos.",rhyhorn brain small dens run forget start run first place appar rememb sometim demolish someth massiv bone time harder human bone easili knock trailer fli power tackl destroy anyth howev slow wit help peopl work strong bright pokemon shatter even skyscrap charg tackl care anyth way charg destroy ob stacl strong bright pokemon shatter even skyscrap charg tackl strong bright pokemon shatter even skyscrap charg tackl start run stop tini brain make stupid rememb start run first place rhyhorn run straight line smash everyth path bother even rush headlong block steel pokemon may feel pain collis next day howev pokemon one track mind charg stop run fall asleep pokemon one track mind charg stop run fall asleep rememb one thing time start rush forget start care anyth way charg destroy obstacl ludicr strong butt head mountain mountain shatter short leg struggl turn incap stop unless collid someth bodi clad thick hide tackl toppl build unfortun smart massiv bone time harder human bone tackl knock semitrail fli inept turn four short leg charg run one direct rhyhorn brain small dens run forget start run first place appar rememb sometim demolish someth rhyhorn run straight line smash everyth path bother even rush headlong block steel pokemon may feel pain collis next day howev
rhydon,ground,rock,105,130,120,45,45,40,"Its brain developed after it stood up on its hind legs. Its drill horn bores tunnels through solid rock. Rapidly rotates its horn to bore through bedrock. It swaggers around volcanic regions, protected from the lava's heat by its tough, armorlike hide. Its brain developed when it began walking on its hind legs. Its armor-like hide even repels molten lava. Standing on its hind legs freed its forelegs and made it smarter. It is very forgetful, however. By lightly spin­ ning its drill- like horn, it can easily shatter even a diamond in the rough. Its brain devel­ oped when it began walking on hind legs. Its thick hide protects it even in magma. Rhydon has a horn that serves as a drill. It is used for destroying rocks and boulders. This Pokémon occasionally rams into streams of magma, but the armor-like hide prevents it from feeling the heat. Protected by an armor-like hide, it is capable of living in molten lava of 3,600 degrees. Protected by an armor-like hide, it is capable of living in molten lava of 3,600 degrees Fahrenheit. Its brain developed when it began walking on hind legs. Its thick hide protects it even in magma. RHYDON’s horn can crush even uncut diamonds. One sweeping blow of its tail can topple a building. This POKéMON’s hide is extremely tough. Even direct cannon hits don’t leave a scratch. Walks on its hind legs. Shows signs of intelligence. Its armor-like hide even repels molten lava. Its horn, which rotates like a drill, destroys tall buildings with one strike. It stands on its hind legs, and its brain is well developed. Rhydon’s horn can crush even uncut diamonds. One sweeping blow of its tail can topple a building. This Pokémon’s hide is extremely tough. Even direct cannon hits don’t leave a scratch. It begins walking on its hind legs after evolution. It can punch holes through boulders with its horn. Its rugged hide protects it from even the heat of lava. However, the hide also makes it insensitive. RHYDON has a horn that serves as a drill. It is used for destroying rocks and boulders. This POKéMON occasionally rams into streams of magma, but the armor-like hide prevents it from feeling the heat.",0,Muralha Física,"Especialistas em defesa física. Aguentam golpes potentes, mas costumam ser lentos.",brain develop stood hind leg drill horn bore tunnel solid rock rapid rotat horn bore bedrock swagger around volcan region protect lava heat tough armorlik hide brain develop began walk hind leg armor like hide even repel molten lava stand hind leg freed foreleg made smarter forget howev light spin ning drill like horn easili shatter even diamond rough brain devel ope began walk hind leg thick hide protect even magma rhydon horn serv drill use destroy rock boulder pokemon occasion ram stream magma armor like hide prevent feel heat protect armor like hide capabl live molten lava degre protect armor like hide capabl live molten lava degre fahrenheit brain develop began walk hind leg thick hide protect even magma rhydon horn crush even uncut diamond one sweep blow tail toppl build pokemon hide extrem tough even direct cannon hit leav scratch walk hind leg show sign intellig armor like hide even repel molten lava horn rotat like drill destroy tall build one strike stand hind leg brain well develop rhydon horn crush even uncut diamond one sweep blow tail toppl build pokemon hide extrem tough even direct cannon hit leav scratch begin walk hind leg evolut punch hole boulder horn rug hide protect even heat lava howev hide also make insensit rhydon horn serv drill use destroy rock boulder pokemon occasion ram stream magma armor like hide prevent feel heat
chansey,normal,,250,5,5,35,105,50,"A gentle and kindhearted Pokémon that shares its nutritious eggs if it sees an injured Pokémon. A kindly Pokémon that lays highly nutritious eggs and shares them with injured Pokémon or people. Being few in number and difficult to capture, it is said to bring happiness to the Trainer who catches it. A rare and elusive POKéMON that is said to bring happiness to those who manage to get it. People try to catch it for its extremely nutritious eggs, but it rarely can be found. It lays several eggs a day and won’t share them with those who have evil in their hearts. CHANSEY lay nutritionally excellent eggs every day. The eggs are so delicious, they are eagerly devoured by even those people who have lost their appetite. Chansey lays nutritionally excellent eggs on an everyday basis. The eggs are so delicious, they are easily and eagerly devoured by even those people who have lost their appetite. A rare and elusive POKéMON that is said to bring happiness to those who manage to catch one. The egg Chansey carries is not only delicious but also packed with nutrition. It’s used as a high-class cooking ingredient. It seems that other Pokémon’s efforts to take its delicious, nutritious egg away from it caused Chansey to get faster at fleeing. It lays several eggs a day. The eggs are apparently rich in nutrients and extremely delicious. A gentle and kind­ hearted POKéMON that shares its nutritious eggs if it sees an injured POKéMON. This purehearted Pokémon shares its eggs with the injured. Few in number and difficult to cap­ ture, it is said to bring happiness to the trainer who catches it. The eggs laid by Chansey are rich in nutrients and a favorite food of many Pokémon. It is said to deliver happiness. Being compassionate, it shares its eggs with injured people. CHANSEY lays nutritionally excellent eggs on an everyday basis. The eggs are so delicious, they are easily and eagerly devoured by even those people who have lost their appetite. Because the eggs on their bellies have been overharvested by people in the past, the Chansey population remains very small. It walks carefully to prevent its egg from breaking. However, it is extremely fast at running away. Not only are these Pokémon fast runners, they’re also few in number, so anyone who finds one must be lucky indeed. This species was once very slow. To protect their eggs from other creatures, these Pokémon became able to flee quickly.",2,Colosso de Vitalidade,Os pesos-pesados. Destacam-se pelo HP altíssimo e grande resistência a danos especiais. Possuem os restantes dos atributos médios/altos.,gentl kindheart pokemon share nutriti egg see injur pokemon kind pokemon lay high nutriti egg share injur pokemon peopl number difficult captur said bring happi trainer catch rare elus pokemon said bring happi manag get peopl tri catch extrem nutriti egg rare found lay sever egg day share evil heart chansey lay nutrit excel egg everi day egg delici eager devour even peopl lost appetit chansey lay nutrit excel egg everyday basi egg delici easili eager devour even peopl lost appetit rare elus pokemon said bring happi manag catch one egg chansey carri delici also pack nutrit use high class cook ingredi seem pokemon effort take delici nutriti egg away caus chansey get faster flee lay sever egg day egg appar rich nutrient extrem delici gentl kind heart pokemon share nutriti egg see injur pokemon pureheart pokemon share egg injur number difficult cap ture said bring happi trainer catch egg laid chansey rich nutrient favorit food mani pokemon said deliv happi compassion share egg injur peopl chansey lay nutrit excel egg everyday basi egg delici easili eager devour even peopl lost appetit egg belli overharvest peopl past chansey popul remain small walk care prevent egg break howev extrem fast run away pokemon fast runner also number anyon find one must lucki inde speci slow protect egg creatur pokemon becam abl flee quick
tangela,grass,,65,55,115,100,40,60,"Many writhing vines cover it, so its true identity remains unknown. The blue vines grow its whole life long. Its identity is obscured by masses of thick, blue vines. The vines are said to never stop growing. The whole body is swathed with wide vines that are similar to seaweed. The vines sway as it walks. The vines that cloak its entire body are always jiggling. They effectively un­ nerve its foes. Its identity is obscured by masses of thick blue vines. The vines are said to never stop growing. Its vines snap off easily and painlessly if they are grabbed, allowing it to make a quick getaway. The lost vines are replaced by new growth the very next day. TANGELA’s vines snap off easily if they are grabbed. This happens without pain, allowing it to make a quick getaway. The lost vines are replaced by newly grown vines the very next day. The blue vines shrouding its body are covered in a growth of fine hair. It is known to be ticklish. It tangles any moving thing with its vines. Their subtle shaking is ticklish if you get ensnared. The vines that cloak its entire body are always jiggling. They effectively unnerve its foes. It is cloaked entirely in blue vines, preventing any glimpse of its true identity. The vines impart a refreshing sensation when chewed—they're useful as a spice. The whole body is swathed with wide vines that are similar to sea­ weed. Its vines shake as it walks. Tangela’s vines snap off easily if they are grabbed. This happens without pain, allowing it to make a quick getaway. The lost vines are replaced by newly grown vines the very next day. Hidden beneath a tangle of vines that grows nonstop even if the vines are torn off, this Pokémon’s true appearance remains a mystery. Blue plant vines cloak the POKéMON’s identity in a tangled mass. It entangles anything that gets close. The vines of a Tangela have a distinct scent. In some parts of Galar, Tangela vines are used as herbs. It is shrouded by blue vines. No one has seen the face hidden behind this growth of vines. During battle, it constantly moves the vines that cover its body in order to annoy its opponent.",0,Muralha Física,"Especialistas em defesa física. Aguentam golpes potentes, mas costumam ser lentos.",mani writh vine cover true ident remain unknown blue vine grow whole life long ident obscur mass thick blue vine vine said never stop grow whole bodi swath wide vine similar seawe vine sway walk vine cloak entir bodi alway jiggl effect un nerv foe ident obscur mass thick blue vine vine said never stop grow vine snap easili painless grab allow make quick getaway lost vine replac new growth next day tangela vine snap easili grab happen without pain allow make quick getaway lost vine replac newli grown vine next day blue vine shroud bodi cover growth fine hair known ticklish tangl move thing vine subtl shake ticklish get ensnar vine cloak entir bodi alway jiggl effect unnerv foe cloak entir blue vine prevent glimps true ident vine impart refresh sensat chew use spice whole bodi swath wide vine similar sea weed vine shake walk tangela vine snap easili grab happen without pain allow make quick getaway lost vine replac newli grown vine next day hidden beneath tangl vine grow nonstop even vine torn pokemon true appear remain mysteri blue plant vine cloak pokemon ident tangl mass entangl anyth get close vine tangela distinct scent part galar tangela vine use herb shroud blue vine one seen face hidden behind growth vine battl constant move vine cover bodi order annoy oppon
